{
  "report_id": "rep_mining_ugv_email_2026",
  "title": "Mining Underground Ground Vehicles (UGV) Market",
  "created_at": "2026-09-18T12:00:00Z",
  "template_set": "mining_ugv",
  "defaults": {
    "background": "bg_02.png",
    "font_family": "Arial",
    "accent_color": "#1B365D"
  },
  "slides": [
    {
      "template_id": "01_cover_title_image",
      "slide_index": 0,
      "data": {
        "title": {
          "type": "text",
          "id": "cov_title",
          "value": "Mining Underground Ground Vehicles (UGV) Market"
        },
        "subtitle": {
          "type": "text",
          "id": "cov_sub",
          "value": "Global Fleet Sizing, Autonomous Navigation & Commercial Forecast 2020-2030F"
        },
        "metadata": {
          "type": "text",
          "id": "cov_meta",
          "value": "Industry Intelligence Report | Source: Comprehensive Mining Research | September 2026"
        }
      }
    },
    {
      "template_id": "02_toc_image",
      "slide_index": 1,
      "data": {
        "items": [
          {
            "type": "toc_item",
            "id": "toc_01",
            "number": "01",
            "title": "Executive Summary & Strategic Findings"
          },
          {
            "type": "toc_item",
            "id": "toc_02",
            "number": "02",
            "title": "Market Scope, Definitions & Taxonomy"
          },
          {
            "type": "toc_item",
            "id": "toc_03",
            "number": "03",
            "title": "Historical Market Sizing (2020-2030F)"
          },
          {
            "type": "toc_item",
            "id": "toc_04",
            "number": "04",
            "title": "Market Structure & Core Segmentation"
          },
          {
            "type": "toc_item",
            "id": "toc_05",
            "number": "05",
            "title": "Installed Base & Replacement Cycles"
          },
          {
            "type": "toc_item",
            "id": "toc_06",
            "number": "06",
            "title": "Technology, Sensor Fusion & SLAM"
          },
          {
            "type": "toc_item",
            "id": "toc_07",
            "number": "07",
            "title": "Application & End-User Intelligence"
          },
          {
            "type": "toc_item",
            "id": "toc_08",
            "number": "08",
            "title": "Buyer Decision-Making Intelligence"
          },
          {
            "type": "toc_item",
            "id": "toc_09",
            "number": "09",
            "title": "Customer Requirements & Specifications"
          },
          {
            "type": "toc_item",
            "id": "toc_10",
            "number": "10",
            "title": "Voice of Customer & Pain Points"
          },
          {
            "type": "toc_item",
            "id": "toc_11",
            "number": "11",
            "title": "Pricing, Transaction & Negotiation"
          },
          {
            "type": "toc_item",
            "id": "toc_12",
            "number": "12",
            "title": "Purchase Intent & Budget Allocation"
          },
          {
            "type": "toc_item",
            "id": "toc_13",
            "number": "13",
            "title": "Technology Adoption & Trial Pipeline"
          },
          {
            "type": "toc_item",
            "id": "toc_14",
            "number": "14",
            "title": "Regional Intelligence: Europe & Germany"
          },
          {
            "type": "toc_item",
            "id": "toc_15",
            "number": "15",
            "title": "Value Chain & Ecosystem Analysis"
          },
          {
            "type": "toc_item",
            "id": "toc_16",
            "number": "16",
            "title": "Customer-Validated White-Space Matrix"
          },
          {
            "type": "toc_item",
            "id": "toc_17",
            "number": "17",
            "title": "Company Benchmarking: Komatsu Ltd."
          },
          {
            "type": "toc_item",
            "id": "toc_18",
            "number": "18",
            "title": "Strategic Recommendations & 2030 Roadmap"
          }
        ]
      }
    },
    {
      "template_id": "03_section_opener",
      "slide_index": 2,
      "data": {
        "section_title": {
          "type": "text",
          "id": "s1_title",
          "value": "1. Executive Summary & Strategic Findings"
        },
        "index_list": [
          {
            "type": "index_item",
            "id": "sub_1_1",
            "number": "1.1",
            "title": "Market Snapshot & Growth Trajectory"
          },
          {
            "type": "index_item",
            "id": "sub_1_2",
            "number": "1.2",
            "title": "Demand & Near-Term Purchase Pipeline"
          },
          {
            "type": "index_item",
            "id": "sub_1_3",
            "number": "1.3",
            "title": "Application Demand & Fleet Economics"
          },
          {
            "type": "index_item",
            "id": "sub_1_4",
            "number": "1.4",
            "title": "Critical Buyer Specifications & Thresholds"
          },
          {
            "type": "index_item",
            "id": "sub_1_5",
            "number": "1.5",
            "title": "Core Technology Adoption Dynamics"
          },
          {
            "type": "index_item",
            "id": "sub_1_6",
            "number": "1.6",
            "title": "Strategic Market Opportunities & White-Space"
          }
        ]
      }
    },
    {
      "template_id": "04_table_chart",
      "slide_index": 3,
      "data": {
        "context_note": {
          "type": "text",
          "id": "s4_note",
          "value": "Comprehensive market valuation and fleet growth across forecast horizons (2025-2030F)"
        },
        "chart": {
          "type": "chart",
          "id": "ch_s4_val",
          "chart_type": "bar",
          "title": "Mining UGV Market Value ($M) & Annual Deployments (Units)",
          "data": {
            "categories": [
              "2025",
              "2026E",
              "2030F"
            ],
            "series": [
              {
                "name": "Market Value Midpoint ($M)",
                "values": [
                  220,
                  270,
                  650
                ]
              },
              {
                "name": "Deployments Midpoint (Units)",
                "values": [
                  1350,
                  1750,
                  4500
                ]
              }
            ]
          }
        },
        "section_heading": {
          "type": "text",
          "id": "s4_head",
          "value": "Market Acceleration & Underground Share"
        },
        "narrative": {
          "type": "text",
          "id": "s4_narr",
          "value": "Underground operations account for 60-72% of total UGV demand, expanding at an 18-23% CAGR. Market value is projected to reach $520-780M by 2030 as operators transition from single-vehicle trials to multi-unit fleet production."
        },
        "table": {
          "type": "table",
          "id": "tbl_s4_snap",
          "headers": [
            "Metric",
            "2025",
            "2026E",
            "2030F"
          ],
          "rows": [
            [
              "Market value",
              "USD 180-260M",
              "USD 220-320M",
              "USD 520-780M"
            ],
            [
              "Unit deployments",
              "1,100-1,600",
              "1,400-2,100",
              "3,500-5,500"
            ],
            [
              "Installed base",
              "4,000-6,000",
              "5,000-7,500",
              "12,000-18,000"
            ],
            [
              "Average system ASP",
              "USD 140K-220K",
              "USD 140K-225K",
              "USD 120K-200K"
            ]
          ]
        },
        "supporting_insight": {
          "type": "insight",
          "id": "ins_s4_snap",
          "blocks": [
            {
              "id": "ins_s4_snap_b",
              "title": "Worker Safety Driving CAPEX Budgets",
              "body": "Worker exposure reduction ranks as the #1 purchase trigger (18-24% weighting), far exceeding initial equipment price (4-7%), compelling rapid fleet automation in hazardous stopes."
            }
          ]
        }
      }
    },
    {
      "template_id": "05_insight_information",
      "slide_index": 4,
      "data": {
        "title": {
          "type": "text",
          "id": "s5_title",
          "value": "Strategic Market Findings & Structural Buyer Dynamics"
        },
        "left_column": [
          {
            "type": "text",
            "id": "s5_l_h",
            "value": "Key Commercial Transition Vectors",
            "role": "heading"
          },
          {
            "type": "text",
            "id": "s5_l_p",
            "value": "Underground mining represents the primary near-term commercial market. While inspection and mapping are the dominant initial entry points, safety, hazardous-area intervention, and production-support systems are expanding at the fastest CAGR."
          },
          {
            "type": "bullet_list",
            "id": "s5_l_b",
            "items": [
              {
                "id": "s5_l_b_1",
                "text": "Pilot conversion is the principal bottleneck: 35-55% of mine pilots convert to commercial contracts."
              },
              {
                "id": "s5_l_b_2",
                "text": "Retrofit autonomy kits offer a faster, lower-CAPEX route than complete machinery replacement."
              },
              {
                "id": "s5_l_b_3",
                "text": "Multi-unit fleet deployments (10-50+ units) trigger massive operational economies of scale."
              }
            ]
          }
        ],
        "right_column": [
          {
            "type": "text",
            "id": "s5_r_h",